[
  {
    "speciesId": "charizard",
    "id": "charizard-mega-y",
    "name": "Charizard-Mega-Y",
    "types": ["FIRE", "FLYING"],
    "baseStats": { "hp": 78, "attack": 104, "defense": 78, "specialAttack": 159, "specialDefense": 115, "speed": 100 },
    "ability": "NONE"
  },
  {
    "speciesId": "gengar",
    "id": "gengar-mega",
    "name": "Gengar-Mega",
    "types": ["GHOST", "POISON"],
    "baseStats": { "hp": 60, "attack": 65, "defense": 80, "specialAttack": 170, "specialDefense": 95, "speed": 130 },
    "ability": "NONE"
  },
  {
    "speciesId": "gyarados",
    "id": "gyarados-mega",
    "name": "Gyarados-Mega",
    "types": ["WATER", "DARK"],
    "baseStats": { "hp": 95, "attack": 155, "defense": 109, "specialAttack": 70, "specialDefense": 130, "speed": 81 },
    "ability": "NONE"
  },
  {
    "speciesId": "tyranitar",
    "id": "tyranitar-mega",
    "name": "Tyranitar-Mega",
    "types": ["ROCK", "DARK"],
    "baseStats": { "hp": 100, "attack": 164, "defense": 150, "specialAttack": 95, "specialDefense": 120, "speed": 71 },
    "ability": "NONE"
  },
  {
    "speciesId": "garchomp",
    "id": "garchomp-mega",
    "name": "Garchomp-Mega",
    "types": ["DRAGON", "GROUND"],
    "baseStats": { "hp": 108, "attack": 170, "defense": 115, "specialAttack": 120, "specialDefense": 95, "speed": 92 },
    "ability": "NONE"
  },
  {
    "speciesId": "salamence",
    "id": "salamence-mega",
    "name": "Salamence-Mega",
    "types": ["DRAGON", "FLYING"],
    "baseStats": { "hp": 95, "attack": 145, "defense": 130, "specialAttack": 120, "specialDefense": 90, "speed": 120 },
    "ability": "NONE"
  },
  {
    "speciesId": "scizor",
    "id": "scizor-mega",
    "name": "Scizor-Mega",
    "types": ["BUG", "STEEL"],
    "baseStats": { "hp": 70, "attack": 150, "defense": 140, "specialAttack": 65, "specialDefense": 100, "speed": 75 },
    "ability": "NONE"
  }
]
